{
  "$schema": "https://json-schema.org/draft/2020-12/schema",
  "$id": "https://c360.studio/semconnect/migrate-semstreams-beta147/cutover-manifest.schema.json",
  "title": "Semconnect SemStreams beta.147 cutover manifest",
  "type": "object",
  "additionalProperties": false,
  "required": [
    "manifestVersion",
    "change",
    "template",
    "immutable",
    "environment",
    "deploymentValues",
    "destructiveScope",
    "retainedState",
    "authoritativeSource",
    "readiness",
    "rollback",
    "approvals",
    "p0Gate",
    "execution"
  ],
  "properties": {
    "manifestVersion": {"const": "1.0.0"},
    "change": {"const": "migrate-semstreams-beta147"},
    "template": {"type": "boolean"},
    "immutable": {"type": "boolean"},
    "environment": {"$ref": "#/$defs/environment"},
    "deploymentValues": {"$ref": "#/$defs/deploymentValues"},
    "destructiveScope": {
      "type": "array",
      "items": {"$ref": "#/$defs/destructiveResource"}
    },
    "retainedState": {
      "type": "array",
      "items": {"$ref": "#/$defs/retainedResource"}
    },
    "authoritativeSource": {"$ref": "#/$defs/authoritativeSource"},
    "readiness": {"$ref": "#/$defs/readiness"},
    "rollback": {"$ref": "#/$defs/rollback"},
    "approvals": {
      "type": "array",
      "items": {"$ref": "#/$defs/approval"}
    },
    "p0Gate": {"$ref": "#/$defs/p0Gate"},
    "execution": {"$ref": "#/$defs/execution"}
  },
  "allOf": [
    {
      "if": {
        "properties": {
          "execution": {
            "properties": {"authorized": {"const": true}},
            "required": ["authorized"]
          }
        }
      },
      "then": {
        "properties": {
          "template": {"const": false},
          "immutable": {"const": true},
          "destructiveScope": {"minItems": 1},
          "retainedState": {"minItems": 2},
          "approvals": {
            "minItems": 5,
            "allOf": [
              {"contains": {"properties": {"role": {"const": "architect"}}}},
              {"contains": {"properties": {"role": {"const": "product-owner"}}}},
              {"contains": {"properties": {"role": {"const": "operator"}}}},
              {
                "contains": {"properties": {"role": {"const": "destructive-reviewer"}}},
                "minContains": 2
              }
            ]
          },
          "p0Gate": {
            "properties": {
              "status": {"const": "approved"},
              "blockingConditions": {"maxItems": 0}
            }
          },
          "execution": {
            "properties": {
              "goNoGoDecision": {"const": "go"}
            }
          },
          "environment": {
            "properties": {
              "name": {"$ref": "#/$defs/literal"},
              "natsContext": {"$ref": "#/$defs/literal"},
              "natsAccount": {"$ref": "#/$defs/literal"},
              "natsServer": {"$ref": "#/$defs/literal"},
              "maintenanceWindow": {"$ref": "#/$defs/literal"}
            }
          },
          "deploymentValues": {
            "properties": {
              "semconnectRevision": {"$ref": "#/$defs/literal"},
              "backendImage": {"$ref": "#/$defs/literal"},
              "activeWriters": {"items": {"$ref": "#/$defs/literal"}}
            }
          },
          "retainedState": {
            "items": {
              "properties": {
                "renderedName": {"$ref": "#/$defs/literal"},
                "account": {"$ref": "#/$defs/literal"},
                "identityImpact": {"const": "none"},
                "probe": {"$ref": "#/$defs/literal"}
              }
            }
          },
          "authoritativeSource": {
            "properties": {
              "uri": {"$ref": "#/$defs/literal"},
              "revision": {"$ref": "#/$defs/literal"},
              "sha256": {
                "not": {"const": "0000000000000000000000000000000000000000000000000000000000000000"}
              },
              "owner": {"$ref": "#/$defs/literal"},
              "reseedCommand": {"$ref": "#/$defs/literal"}
            }
          },
          "readiness": {
            "properties": {
              "entityStatesBucket": {"$ref": "#/$defs/literal"},
              "statusProbe": {"$ref": "#/$defs/literal"},
              "parityProbes": {"items": {"$ref": "#/$defs/literal"}},
              "replayProbe": {"$ref": "#/$defs/literal"}
            }
          },
          "rollback": {
            "properties": {
              "owner": {"$ref": "#/$defs/literal"}
            }
          }
        }
      }
    }
  ],
  "$defs": {
    "literal": {
      "type": "string",
      "minLength": 1,
      "not": {"pattern": "(REQUIRED|TBD|\\$\\{|[*?~])"}
    },
    "environment": {
      "type": "object",
      "additionalProperties": false,
      "required": ["name", "natsContext", "natsAccount", "natsServer", "maintenanceWindow"],
      "properties": {
        "name": {"type": "string", "minLength": 1},
        "natsContext": {"type": "string", "minLength": 1},
        "natsAccount": {"type": "string", "minLength": 1},
        "natsServer": {"type": "string", "minLength": 1},
        "maintenanceWindow": {"type": "string", "minLength": 1}
      }
    },
    "deploymentValues": {
      "type": "object",
      "additionalProperties": false,
      "required": [
        "semconnectRevision",
        "semstreamsVersion",
        "semstreamsCommit",
        "backendImage",
        "backendCommit",
        "activeWriters"
      ],
      "properties": {
        "semconnectRevision": {"type": "string", "minLength": 1},
        "semstreamsVersion": {"const": "v1.0.0-beta.147"},
        "semstreamsCommit": {"const": "5cc22c109594e48b7f1cec04bcaaf0106d85495a"},
        "backendImage": {"type": "string", "minLength": 1},
        "backendCommit": {"const": "5cc22c109594e48b7f1cec04bcaaf0106d85495a"},
        "activeWriters": {"type": "array", "minItems": 1, "items": {"type": "string", "minLength": 1}}
      }
    },
    "destructiveResource": {
      "type": "object",
      "additionalProperties": false,
      "required": ["kind", "renderedName", "account", "expectedPreCount", "literalCommand", "reason"],
      "properties": {
        "kind": {"enum": ["kv-bucket", "object-store", "stream"]},
        "renderedName": {"$ref": "#/$defs/literal"},
        "account": {"$ref": "#/$defs/literal"},
        "expectedPreCount": {"type": "integer", "minimum": 0},
        "literalCommand": {"$ref": "#/$defs/literal"},
        "reason": {"type": "string", "minLength": 1}
      }
    },
    "retainedResource": {
      "type": "object",
      "additionalProperties": false,
      "required": ["kind", "renderedName", "account", "preCutoverCount", "identityImpact", "probe"],
      "properties": {
        "kind": {"enum": ["kv-bucket", "object-store", "stream"]},
        "renderedName": {"type": "string", "minLength": 1},
        "account": {"type": "string", "minLength": 1},
        "preCutoverCount": {"type": "integer", "minimum": 0},
        "identityImpact": {"enum": ["none", "review-required", "blocked"]},
        "probe": {"type": "string", "minLength": 1}
      }
    },
    "authoritativeSource": {
      "type": "object",
      "additionalProperties": false,
      "required": ["uri", "revision", "sha256", "expectedEntityCount", "owner", "reseedCommand"],
      "properties": {
        "uri": {"type": "string", "minLength": 1},
        "revision": {"type": "string", "minLength": 1},
        "sha256": {"type": "string", "pattern": "^[0-9a-f]{64}$"},
        "expectedEntityCount": {"type": "integer", "minimum": 0},
        "owner": {"type": "string", "minLength": 1},
        "reseedCommand": {"type": "string", "minLength": 1}
      }
    },
    "readiness": {
      "type": "object",
      "additionalProperties": false,
      "required": ["entityStatesBucket", "capturedRevision", "statusProbe", "parityProbes", "replayProbe"],
      "properties": {
        "entityStatesBucket": {"type": "string", "minLength": 1},
        "capturedRevision": {"type": "integer", "minimum": 0},
        "statusProbe": {"type": "string", "minLength": 1},
        "parityProbes": {"type": "array", "minItems": 1, "items": {"type": "string", "minLength": 1}},
        "replayProbe": {"type": "string", "minLength": 1}
      }
    },
    "rollback": {
      "type": "object",
      "additionalProperties": false,
      "required": ["owner", "strategy", "oldBinaryOnChangedAccount", "triggers"],
      "properties": {
        "owner": {"type": "string", "minLength": 1},
        "strategy": {"const": "stop-writers-correct-source-repeat-reviewed-clean-rebuild"},
        "oldBinaryOnChangedAccount": {"const": "prohibited"},
        "triggers": {"type": "array", "minItems": 1, "items": {"type": "string", "minLength": 1}}
      }
    },
    "approval": {
      "type": "object",
      "additionalProperties": false,
      "required": ["role", "name", "approvedAt", "manifestSha256"],
      "properties": {
        "role": {"enum": ["architect", "product-owner", "operator", "destructive-reviewer"]},
        "name": {"type": "string", "minLength": 1},
        "approvedAt": {"type": "string", "format": "date-time"},
        "manifestSha256": {"type": "string", "pattern": "^[0-9a-f]{64}$"}
      }
    },
    "p0Gate": {
      "type": "object",
      "additionalProperties": false,
      "required": ["id", "status", "blockingConditions"],
      "properties": {
        "id": {"const": "SEMSTREAMS-BETA147-PRODUCTION-CUTOVER"},
        "status": {"enum": ["blocked", "approved"]},
        "blockingConditions": {"type": "array", "items": {"type": "string", "minLength": 1}}
      }
    },
    "execution": {
      "type": "object",
      "additionalProperties": false,
      "required": ["authorized", "goNoGoDecision"],
      "properties": {
        "authorized": {"type": "boolean"},
        "goNoGoDecision": {"enum": ["pending", "go", "no-go"]}
      }
    }
  }
}
